{
  "$schema": "https://json-schema.org/draft/2020-12/schema",
  "$id": "https://contracts.hermes.local/cloud/payloads/session-snapshot-v2.schema.json",
  "title": "Hermes Connector Session Snapshot Payload v2",
  "type": "object",
  "additionalProperties": false,
  "required": [
    "observer_contract",
    "profile",
    "runtime_generation",
    "session_key",
    "runtime_session_id",
    "running",
    "status",
    "event_sequence",
    "snapshot_event_sequence",
    "messages",
    "inflight",
    "todo_sections",
    "subagents",
    "tools",
    "terminals",
    "replay_events"
  ],
  "properties": {
    "observer_contract": {"const": 2},
    "profile": {"type": "string", "minLength": 1, "maxLength": 128, "pattern": "^(?![\\s\\S]*[^A-Za-z0-9_.-])[A-Za-z0-9_.-]+$"},
    "runtime_generation": {"type": "string", "minLength": 1, "maxLength": 128},
    "session_key": {"$ref": "#/$defs/identifier"},
    "runtime_session_id": {"$ref": "#/$defs/identifier"},
    "running": {"type": "boolean"},
    "status": {"type": "string", "minLength": 1, "maxLength": 64},
    "event_sequence": {"type": "integer", "minimum": 0, "maximum": 9007199254740991},
    "snapshot_event_sequence": {"type": "integer", "minimum": 0, "maximum": 9007199254740991},
    "messages": {
      "type": "array", "maxItems": 500,
      "items": {
        "type": "object", "additionalProperties": false, "required": ["role"],
        "properties": {"role": {"type": "string", "minLength": 1, "maxLength": 64}, "content": {"type": ["string", "null"], "maxLength": 131072}}
      }
    },
    "inflight": {
      "type": "object", "additionalProperties": false, "required": ["user", "assistant", "streaming", "error"],
      "properties": {
        "user": {"type": ["string", "null"], "maxLength": 131072},
        "assistant": {"type": ["string", "null"], "maxLength": 131072},
        "streaming": {"type": "boolean"},
        "error": {"type": ["string", "null"], "maxLength": 4096}
      }
    },
    "todo_sections": {"type": "array", "maxItems": 64, "uniqueItems": true, "items": {"$ref": "#/$defs/todoState"}},
    "subagents": {"type": "array", "maxItems": 128, "uniqueItems": true, "items": {"$ref": "#/$defs/subagentState"}},
    "tools": {"type": "array", "maxItems": 128, "uniqueItems": true, "items": {"$ref": "#/$defs/toolState"}},
    "terminals": {"type": "array", "maxItems": 128, "uniqueItems": true, "items": {"$ref": "#/$defs/terminalState"}},
    "replay_events": {"type": "array", "maxItems": 1024, "items": {"$ref": "session-event-v2.schema.json"}},
    "extensions": {
      "type": "object", "maxProperties": 16,
      "propertyNames": {"pattern": "^[a-z][a-z0-9]*(\\.[a-z0-9][a-z0-9-]*)+$"},
      "additionalProperties": {"type": "object"}
    }
  },
  "$defs": {
    "identifier": {"type": "string", "minLength": 1, "maxLength": 256},
    "revision": {"type": "integer", "minimum": 1, "maximum": 9007199254740991},
    "todoItem": {
      "type": "object", "additionalProperties": false, "required": ["id", "label", "status"],
      "properties": {
        "id": {"$ref": "#/$defs/identifier"}, "label": {"type": "string", "minLength": 1, "maxLength": 4096},
        "status": {"enum": ["pending", "in_progress", "completed", "cancelled"]}
      }
    },
    "todoState": {
      "type": "object", "additionalProperties": false,
      "required": ["turn_id", "section_id", "revision", "first_event_sequence", "status", "items"],
      "properties": {
        "turn_id": {"$ref": "#/$defs/identifier"}, "section_id": {"$ref": "#/$defs/identifier"},
        "revision": {"$ref": "#/$defs/revision"}, "first_event_sequence": {"$ref": "#/$defs/revision"},
        "status": {"enum": ["pending", "in_progress", "completed", "cancelled"]},
        "items": {"type": "array", "minItems": 1, "maxItems": 256, "items": {"$ref": "#/$defs/todoItem"}}
      }
    },
    "progress": {
      "type": "object", "additionalProperties": false, "required": ["current", "total"],
      "properties": {"current": {"type": "integer", "minimum": 0, "maximum": 9007199254740991}, "total": {"type": "integer", "minimum": 1, "maximum": 9007199254740991}}
    },
    "tokenCounts": {
      "type": "object", "additionalProperties": false, "required": ["input", "output", "reasoning"],
      "properties": {
        "input": {"type": "integer", "minimum": 0, "maximum": 9007199254740991},
        "output": {"type": "integer", "minimum": 0, "maximum": 9007199254740991},
        "reasoning": {"type": "integer", "minimum": 0, "maximum": 9007199254740991}
      }
    },
    "subagentState": {
      "type": "object", "additionalProperties": false,
      "required": ["turn_id", "subagent_id", "revision", "first_event_sequence", "parent_subagent_id", "name", "goal", "summary", "status"],
      "properties": {
        "turn_id": {"$ref": "#/$defs/identifier"}, "subagent_id": {"$ref": "#/$defs/identifier"},
        "revision": {"$ref": "#/$defs/revision"}, "first_event_sequence": {"$ref": "#/$defs/revision"},
        "parent_subagent_id": {"anyOf": [{"$ref": "#/$defs/identifier"}, {"type": "null"}]},
        "name": {"type": "string", "minLength": 1, "maxLength": 160}, "goal": {"type": "string", "maxLength": 4096},
        "summary": {"type": ["string", "null"], "maxLength": 4096},
        "status": {"enum": ["queued", "waiting", "running", "completed", "failed", "interrupted"]},
        "model": {"type": "string", "minLength": 1, "maxLength": 160},
        "duration_ms": {"type": "integer", "minimum": 0, "maximum": 9007199254740991},
        "progress": {"$ref": "#/$defs/progress"}, "token_counts": {"$ref": "#/$defs/tokenCounts"},
        "api_calls": {"type": "integer", "minimum": 0, "maximum": 9007199254740991}
      }
    },
    "lifecycleStatus": {"enum": ["running", "completed", "failed", "interrupted", "unknown"]},
    "toolState": {
      "type": "object", "additionalProperties": false,
      "required": ["turn_id", "tool_call_id", "revision", "first_event_sequence", "status", "name"],
      "properties": {
        "turn_id": {"$ref": "#/$defs/identifier"}, "tool_call_id": {"$ref": "#/$defs/identifier"},
        "revision": {"$ref": "#/$defs/revision"}, "first_event_sequence": {"$ref": "#/$defs/revision"},
        "status": {"$ref": "#/$defs/lifecycleStatus"}, "name": {"type": "string", "minLength": 1, "maxLength": 160},
        "call_label": {"type": "string", "minLength": 1, "maxLength": 4096}, "summary": {"type": "string", "maxLength": 4096},
        "duration_ms": {"type": "integer", "minimum": 0, "maximum": 9007199254740991}
      }
    },
    "terminalState": {
      "type": "object", "additionalProperties": false,
      "required": ["turn_id", "process_id", "revision", "first_event_sequence", "status"],
      "properties": {
        "turn_id": {"$ref": "#/$defs/identifier"}, "process_id": {"$ref": "#/$defs/identifier"},
        "revision": {"$ref": "#/$defs/revision"}, "first_event_sequence": {"$ref": "#/$defs/revision"},
        "status": {"$ref": "#/$defs/lifecycleStatus"},
        "exit_code": {"type": "integer", "minimum": -2147483648, "maximum": 2147483647},
        "summary": {"type": "string", "maxLength": 4096}, "duration_ms": {"type": "integer", "minimum": 0, "maximum": 9007199254740991}
      },
      "allOf": [
        {"if": {"properties": {"status": {"const": "completed"}}, "required": ["status"]}, "then": {"required": ["exit_code"], "properties": {"exit_code": {"const": 0}}}},
        {"if": {"properties": {"status": {"const": "failed"}}, "required": ["status"]}, "then": {"required": ["exit_code"], "properties": {"exit_code": {"not": {"const": 0}}}}},
        {"if": {"properties": {"status": {"enum": ["running", "interrupted", "unknown"]}}, "required": ["status"]}, "then": {"not": {"required": ["exit_code"]}}}
      ]
    }
  }
}
