{
  "observer_contract": 2,
  "profile": "default",
  "runtime_generation": "runtime-20260801-01",
  "session_key": "session-root-1",
  "runtime_session_id": "runtime-session-1",
  "running": true,
  "status": "running",
  "event_sequence": 4,
  "snapshot_event_sequence": 4,
  "messages": [{"role": "assistant", "content": "Display-safe snapshot"}],
  "inflight": {"user": null, "assistant": null, "streaming": false, "error": null},
  "todo_sections": [
    {
      "turn_id": "turn-1", "section_id": "todo-1", "revision": 1,
      "first_event_sequence": 1, "status": "in_progress",
      "items": [{"id": "todo-item-1", "label": "Run focused tests", "status": "in_progress"}]
    }
  ],
  "subagents": [
    {
      "turn_id": "turn-1", "subagent_id": "subagent-root", "revision": 1,
      "first_event_sequence": 2, "parent_subagent_id": null, "name": "Coordinator",
      "goal": "Coordinate checks", "summary": null, "status": "running"
    },
    {
      "turn_id": "turn-1", "subagent_id": "subagent-child", "revision": 1,
      "first_event_sequence": 3, "parent_subagent_id": "subagent-root", "name": "Test runner",
      "goal": "Run checks", "summary": null, "status": "running"
    }
  ],
  "tools": [
    {
      "turn_id": "turn-1", "tool_call_id": "tool-1", "revision": 1,
      "first_event_sequence": 3, "status": "running", "name": "Contract tests"
    }
  ],
  "terminals": [
    {
      "turn_id": "turn-1", "process_id": "process-1", "revision": 1,
      "first_event_sequence": 4, "status": "running"
    }
  ],
  "replay_events": []
}
